{
  "controller_authority": false,
  "documented_ai_test_count": 40,
  "hardware_writes": 0,
  "limitations": [
    "The registry proves documentation coverage and path integrity, not model correctness.",
    "Evaluation claims remain governed by their frozen artifacts and evidence-ledger entries."
  ],
  "multiply_owned_test_paths": [],
  "physical_movements": 0,
  "receipt_sha256": "418fbf951657ad167c0704b6e10488e27511606514b48fefb37e0ebeb0222094",
  "referenced_path_count": 131,
  "registry_sha256": "890da79538c844bf4a3bf961c263e404f9999dd5e4b9447d30071989c13568c9",
  "schema": "tactevra.ai_work_registry_audit.v1",
  "status": "PASS",
  "tracked_ai_test_count": 40,
  "unowned_test_paths": [],
  "workstream_count": 7
}
